{
  "version": "ptk-scenario-v2",
  "name": "Altoro Mutual TestFire authenticated setup",
  "description": "Minimal authentication setup used before authenticated crawl-only benchmark rows.",
  "personas": ["bank-customer"],
  "steps": [
    {
      "id": "login",
      "type": "auth",
      "persona": "bank-customer",
      "target": {
        "route": "/login.jsp"
      },
      "success": {
        "authState": "authenticated"
      }
    }
  ]
}
