{
  "version": "ptk-scenario-v2",
  "name": "BrokenCrystals authenticated setup",
  "description": "Minimal authentication setup used before authenticated crawl-only benchmark rows.",
  "personas": ["shopper"],
  "steps": [
    {
      "id": "login",
      "type": "auth",
      "persona": "shopper",
      "target": {
        "route": "/userlogin"
      },
      "success": {
        "authState": "authenticated"
      }
    }
  ]
}
